{
  "schema_version": "account_settlement_panel.v1",
  "workbench": "Account Workbench",
  "panel": "Account Settlement Panel",
  "route": "/accounts/{account_id}/settlement",
  "fixture_state": "partial",
  "context": {
    "trading_day": "2026-06-14",
    "session_id": "account-workbench.fixture.20260614.005",
    "run_id": "account-settlement.fixture.partial.001",
    "reducer_checkpoint_id": "account-settlement.checkpoint.partial.001",
    "reducer_checkpoint_ts": "2026-06-14T15:11:33Z",
    "stream_state": "partial",
    "projection_owner": "account-console-contracts",
    "source_authority": "typed_blocker"
  },
  "account": {
    "account_id": "acct.demo-19053",
    "account_alias": "19053",
    "account_kind": "real_feed_sandbox_paper"
  },
  "settlement": {
    "trading_day": "2026-06-14",
    "settlement_state": "partial",
    "previous_settlement_ref": "fixture://account-workbench/settlement/acct.demo-19053/2026-06-13",
    "current_settlement_ref": "fixture://account-workbench/settlement/acct.demo-19053/2026-06-14",
    "position_carryover_ref": null,
    "cash": 98240.5,
    "frozen_cash": 0.0,
    "margin": 12624.0,
    "realized_pnl": 0.0,
    "unrealized_pnl": null,
    "fees": 7.5,
    "taxes": 0.0,
    "source_ref": "fixture://account-workbench/settlement/acct.demo-19053/partial-missing-carryover",
    "checksum": "sha256:9797979797979797979797979797979797979797979797979797979797979797"
  },
  "blockers": [
    {
      "blocker_id": "account-console.p004.phase5.position-carryover-ref-missing",
      "severity": "warning",
      "kind": "missing_position_carryover_ref",
      "owner": "external settlement owner",
      "next_action": "Provide carryover ref before accepting continuity across settlement and positions.",
      "source_ref": "fixture://account-workbench/blockers/p004/phase5/position-carryover-ref-missing",
      "checksum": "sha256:9898989898989898989898989898989898989898989898989898989898989898"
    }
  ],
  "source_refs": [
    {
      "kind": "typed_blocker",
      "owner": "account-console-contracts",
      "source_ref": "fixture://account-workbench/blockers/p004/phase5/position-carryover-ref-missing",
      "checksum": "sha256:9898989898989898989898989898989898989898989898989898989898989898",
      "authority": "partial fixture; not settlement truth"
    }
  ],
  "boundaries": {
    "read_only_projection": true,
    "runtime_truth": false,
    "account_truth": false,
    "order_truth": false,
    "ledger_truth": false,
    "ui_truth": false,
    "paper_ready": false,
    "live_ready": false,
    "broker_tradable": false,
    "admission_truth": false,
    "capital_truth": false,
    "action_controls": false
  },
  "rejection_rules": [
    "Reject partial settlement fixture as continuity pass.",
    "Reject UI-derived carryover from positions display."
  ]
}
